{
  "$schema": "https://probityai.github.io/agent-evidence-observer/contract/refund-handoff/0.1/reason-codes.schema.json",
  "profile": "https://probityai.github.io/agent-evidence-observer/contract/refund-handoff/0.1",
  "schema": "refund-handoff-reason-codes/0.1",
  "namespace": "https://probityai.github.io/agent-evidence-observer/contract/refund-handoff/0.1#reason-",
  "reasons": [
    {"uri":"https://probityai.github.io/agent-evidence-observer/contract/refund-handoff/0.1#reason-admission_arguments_mismatch","code":"admission_arguments_mismatch","claims":["admission"],"default_evidence_state":"CONTRADICTED"},
    {"uri":"https://probityai.github.io/agent-evidence-observer/contract/refund-handoff/0.1#reason-admission_authority_id_mismatch","code":"admission_authority_id_mismatch","claims":["admission"],"default_evidence_state":"CONTRADICTED"},
    {"uri":"https://probityai.github.io/agent-evidence-observer/contract/refund-handoff/0.1#reason-admission_checkpoint_admission_ref_mismatch","code":"admission_checkpoint_admission_ref_mismatch","claims":["admission"],"default_evidence_state":"CONTRADICTED"},
    {"uri":"https://probityai.github.io/agent-evidence-observer/contract/refund-handoff/0.1#reason-admission_checkpoint_authority_id_mismatch","code":"admission_checkpoint_authority_id_mismatch","claims":["admission"],"default_evidence_state":"CONTRADICTED"},
    {"uri":"https://probityai.github.io/agent-evidence-observer/contract/refund-handoff/0.1#reason-admission_checkpoint_decision_id_mismatch","code":"admission_checkpoint_decision_id_mismatch","claims":["admission"],"default_evidence_state":"CONTRADICTED"},
    {"uri":"https://probityai.github.io/agent-evidence-observer/contract/refund-handoff/0.1#reason-admission_checkpoint_decision_issuer_mismatch","code":"admission_checkpoint_decision_issuer_mismatch","claims":["admission"],"default_evidence_state":"CONTRADICTED"},
    {"uri":"https://probityai.github.io/agent-evidence-observer/contract/refund-handoff/0.1#reason-admission_checkpoint_decision_scope_mismatch","code":"admission_checkpoint_decision_scope_mismatch","claims":["admission"],"default_evidence_state":"CONTRADICTED"},
    {"uri":"https://probityai.github.io/agent-evidence-observer/contract/refund-handoff/0.1#reason-admission_checkpoint_operation_id_mismatch","code":"admission_checkpoint_operation_id_mismatch","claims":["admission"],"default_evidence_state":"CONTRADICTED"},
    {"uri":"https://probityai.github.io/agent-evidence-observer/contract/refund-handoff/0.1#reason-admission_checkpoint_state_root_mismatch","code":"admission_checkpoint_state_root_mismatch","claims":["admission"],"default_evidence_state":"CONTRADICTED"},
    {"uri":"https://probityai.github.io/agent-evidence-observer/contract/refund-handoff/0.1#reason-admission_checkpoint_workflow_id_mismatch","code":"admission_checkpoint_workflow_id_mismatch","claims":["admission"],"default_evidence_state":"CONTRADICTED"},
    {"uri":"https://probityai.github.io/agent-evidence-observer/contract/refund-handoff/0.1#reason-admission_decision_binding_ref_mismatch","code":"admission_decision_binding_ref_mismatch","claims":["admission"],"default_evidence_state":"CONTRADICTED"},
    {"uri":"https://probityai.github.io/agent-evidence-observer/contract/refund-handoff/0.1#reason-admission_decision_id_mismatch","code":"admission_decision_id_mismatch","claims":["admission"],"default_evidence_state":"CONTRADICTED"},
    {"uri":"https://probityai.github.io/agent-evidence-observer/contract/refund-handoff/0.1#reason-admission_decision_issuer_mismatch","code":"admission_decision_issuer_mismatch","claims":["admission"],"default_evidence_state":"CONTRADICTED"},
    {"uri":"https://probityai.github.io/agent-evidence-observer/contract/refund-handoff/0.1#reason-admission_decision_scope_mismatch","code":"admission_decision_scope_mismatch","claims":["admission"],"default_evidence_state":"CONTRADICTED"},
    {"uri":"https://probityai.github.io/agent-evidence-observer/contract/refund-handoff/0.1#reason-admission_handoff_issuer_mismatch","code":"admission_handoff_issuer_mismatch","claims":["admission"],"default_evidence_state":"CONTRADICTED"},
    {"uri":"https://probityai.github.io/agent-evidence-observer/contract/refund-handoff/0.1#reason-admission_operation_id_mismatch","code":"admission_operation_id_mismatch","claims":["admission"],"default_evidence_state":"CONTRADICTED"},
    {"uri":"https://probityai.github.io/agent-evidence-observer/contract/refund-handoff/0.1#reason-admission_provider_id_mismatch","code":"admission_provider_id_mismatch","claims":["admission"],"default_evidence_state":"CONTRADICTED"},
    {"uri":"https://probityai.github.io/agent-evidence-observer/contract/refund-handoff/0.1#reason-admission_state_root_mismatch","code":"admission_state_root_mismatch","claims":["admission"],"default_evidence_state":"CONTRADICTED"},
    {"uri":"https://probityai.github.io/agent-evidence-observer/contract/refund-handoff/0.1#reason-admission_workflow_id_mismatch","code":"admission_workflow_id_mismatch","claims":["admission"],"default_evidence_state":"CONTRADICTED"},
    {"uri":"https://probityai.github.io/agent-evidence-observer/contract/refund-handoff/0.1#reason-conflicting_decision_evidence","code":"conflicting_decision_evidence","claims":["admission"],"default_evidence_state":"CONTRADICTED"},
    {"uri":"https://probityai.github.io/agent-evidence-observer/contract/refund-handoff/0.1#reason-evidence_verified_after_admission","code":"evidence_verified_after_admission","claims":["admission"],"default_evidence_state":"CONTRADICTED"},
    {"uri":"https://probityai.github.io/agent-evidence-observer/contract/refund-handoff/0.1#reason-missing_admission_commit","code":"missing_admission_commit","claims":["admission","approval_continuity","authenticated_handoff","durable_admission"],"default_evidence_state":"NOT_ESTABLISHED"},
    {"uri":"https://probityai.github.io/agent-evidence-observer/contract/refund-handoff/0.1#reason-missing_approval_evidence","code":"missing_approval_evidence","claims":["admission"],"default_evidence_state":"NOT_ESTABLISHED"},
    {"uri":"https://probityai.github.io/agent-evidence-observer/contract/refund-handoff/0.1#reason-missing_decision_evidence","code":"missing_decision_evidence","claims":["admission"],"default_evidence_state":"NOT_ESTABLISHED"},
    {"uri":"https://probityai.github.io/agent-evidence-observer/contract/refund-handoff/0.1#reason-original_approval_ref_mismatch","code":"original_approval_ref_mismatch","claims":["admission"],"default_evidence_state":"CONTRADICTED"},
    {"uri":"https://probityai.github.io/agent-evidence-observer/contract/refund-handoff/0.1#reason-referenced_approval_evidence_missing","code":"referenced_approval_evidence_missing","claims":["admission"],"default_evidence_state":"NOT_ESTABLISHED"},
    {"uri":"https://probityai.github.io/agent-evidence-observer/contract/refund-handoff/0.1#reason-referenced_decision_evidence_missing","code":"referenced_decision_evidence_missing","claims":["admission"],"default_evidence_state":"NOT_ESTABLISHED"},
    {"uri":"https://probityai.github.io/agent-evidence-observer/contract/refund-handoff/0.1#reason-verified_evidence_arguments_mismatch","code":"verified_evidence_arguments_mismatch","claims":["admission"],"default_evidence_state":"CONTRADICTED"},
    {"uri":"https://probityai.github.io/agent-evidence-observer/contract/refund-handoff/0.1#reason-verified_evidence_contradicted","code":"verified_evidence_contradicted","claims":["admission"],"default_evidence_state":"CONTRADICTED"},
    {"uri":"https://probityai.github.io/agent-evidence-observer/contract/refund-handoff/0.1#reason-verified_evidence_not_established","code":"verified_evidence_not_established","claims":["admission"],"default_evidence_state":"NOT_ESTABLISHED"},

    {"uri":"https://probityai.github.io/agent-evidence-observer/contract/refund-handoff/0.1#reason-missing_post_restart_recovery","code":"missing_post_restart_recovery","claims":["durable_admission"],"default_evidence_state":"NOT_ESTABLISHED"},
    {"uri":"https://probityai.github.io/agent-evidence-observer/contract/refund-handoff/0.1#reason-recovery_admission_ref_mismatch","code":"recovery_admission_ref_mismatch","claims":["durable_admission"],"default_evidence_state":"CONTRADICTED"},
    {"uri":"https://probityai.github.io/agent-evidence-observer/contract/refund-handoff/0.1#reason-recovery_decision_scope_mismatch","code":"recovery_decision_scope_mismatch","claims":["durable_admission"],"default_evidence_state":"CONTRADICTED"},
    {"uri":"https://probityai.github.io/agent-evidence-observer/contract/refund-handoff/0.1#reason-recovery_not_after_commit","code":"recovery_not_after_commit","claims":["durable_admission"],"default_evidence_state":"CONTRADICTED"},
    {"uri":"https://probityai.github.io/agent-evidence-observer/contract/refund-handoff/0.1#reason-recovery_observer_not_separate","code":"recovery_observer_not_separate","claims":["durable_admission"],"default_evidence_state":"CONTRADICTED"},
    {"uri":"https://probityai.github.io/agent-evidence-observer/contract/refund-handoff/0.1#reason-recovery_operation_id_mismatch","code":"recovery_operation_id_mismatch","claims":["durable_admission"],"default_evidence_state":"CONTRADICTED"},
    {"uri":"https://probityai.github.io/agent-evidence-observer/contract/refund-handoff/0.1#reason-recovery_provider_id_mismatch","code":"recovery_provider_id_mismatch","claims":["durable_admission"],"default_evidence_state":"CONTRADICTED"},
    {"uri":"https://probityai.github.io/agent-evidence-observer/contract/refund-handoff/0.1#reason-recovery_state_root_mismatch","code":"recovery_state_root_mismatch","claims":["durable_admission"],"default_evidence_state":"CONTRADICTED"},
    {"uri":"https://probityai.github.io/agent-evidence-observer/contract/refund-handoff/0.1#reason-recovery_workflow_id_mismatch","code":"recovery_workflow_id_mismatch","claims":["durable_admission"],"default_evidence_state":"CONTRADICTED"},